start	end	text
2660080	2662420	Это, кстати, очень, ну, очень полезно почитать.
2662580	2666840	Полезно почитать, как это сделано там в MySQL, в Postgres, наверное,
2666840	2670520	наиболее такая, как бы, хорошо описанная, как бы, вот эта вот история
2670520	2673700	с версионированием строк, как они вот с этим работают.
2673700	2678480	То есть интересно, да, почитать, как это все сделано в KVL, в базах данных.
2678740	2682260	Значит, в KVL, в базах данных, вот всякие наши Mongo и Redis,
2682760	2686080	вот эти вот транзакции, то есть почему они такие быстрые,
2686140	2689260	потому что они очень простые, то есть они просто, как бы, тупые,
2689320	2692060	они не бегают, как бы, не захватывают там миллионы строк, как бы,
2692080	2696560	в одной транзакции, вот, ну, либо они как-то очень так
2696560	2700340	аранжируются там правильно, там быстрее работают чекпоинты,
2700340	2703320	вот эти вот откаты, как бы, поэтому эти базы, они более,
2703440	2703680	более...
2703700	2705420	более быстрые, вот.
2705460	2708380	Но они, конечно, такую логику, как SQL, не позволяют реализовать,
2708460	2712360	там, типа, не знаю, там, там, очень сложных выборок.
2713200	2715580	Вот, и вот эта вот конструкция называется Write a Headlock.
2717100	2721180	Секрет KVL в баз данных, как раз, вот тоже, в Mongo и Redis,
2721220	2727440	в том, что они бегут по вот этому логу крайне предсказуемо
2727440	2730160	с точки зрения потребления ресурсов.
2730160	2732560	То есть они вот эти вот расстояния между чекпоинтами,
2732560	2736740	они, в отличие от SQL, очень здорово измеримы, то есть прям
2736740	2739240	по количеству обновляемых ключей, то есть здесь прямо
2739240	2742820	есть какое-то такое фиксированное N, как бы, и они очень здорово
2742820	2747180	отмеряют вот эти вот кванты исполнения, и у вас компьютер,
2747180	2750940	ну, задействован, задействован на полную, как бы, мощность,
2751020	2753560	он прям жрет максимальное количество вот этих транзакций.
2753640	2756420	А в SQL потенциально может прилететь вот эта вот прям
2756420	2759640	огромная какая-нибудь штука, которая все это дело, как бы,
2759640	2761120	затормозит сильно надолго.
2761120	2768060	Ну, и в SQL базах там бывают, как бы, всякие там процедуры
2768060	2772520	оптимизации вот этих таблиц, уплотнения, когда они приходят,
2772580	2775600	здесь все начинает тормозить, все, все, как бы, останавливаются,
2775740	2778900	процессинг вау останавливается, вот.
2780360	2785100	И есть такой класс, как бы, k-value баз данных, levelDB,
2785600	2789680	его наследница rocksDB, здесь такие две, короче говоря,
2789680	2790900	k-value базы данных.
2791120	2796900	Которые знамениты тем, что они наиболее предсказуемым образом
2796900	2799900	вот этот вот вал, как бы, процесса, то есть очень-очень ровно,
2800180	2804240	то есть никогда не бывает у вас там на компьютере, что CPU у вас вот такой,
2804320	2809380	а потом вдруг вот такой вот, потому что пришел скрипт компактификации
2809380	2813860	вот этой вот таблицы или там что-нибудь еще, то есть или там пришел там,
2813900	2817180	я не знаю, там какой-то супер запрос, который все, как бы, повалил,
2817180	2820860	то есть они работают прям ровно, то есть больше ключей вот так вот,
2820960	2821100	вот так вот.
2821120	2826120	И пока не упрутся в 100%, как бы, ну, там уже, как бы, да, ловить нечего,
2826200	2828420	там все умерло, вот.
2830020	2835120	И, ну, у них там специально от слова, как бы, level, там на самом деле идет,
2835900	2841600	как бы, вот этот первый вал в write a headlock, данные из него собираются,
2841680	2847140	как бы, там во второго уровня, там level 2, как бы, там упаковываются,
2847140	2851080	там достаточно тоже предсказуемо, потом level 2, как бы, еще,
2851120	2855400	упаковываются в следующий, как бы, лейер, вот.
2855440	2859680	И вот таким вот образом здесь получается такой очень ровный, предсказуемый процессор.
2859800	2864320	Поэтому вот блокчейн ноды выбирают вот такие вот базы данных,
2864480	2870380	level db, rocks db, под капотом и у Геса, и там, по-моему, и у Эрегона,
2870760	2875340	и в RAST-имплементациях, и в Тоне, и в Polkadot, короче говоря,
2875340	2880880	ну, то есть и в разных блокчейнах, как бы, под капотом очень часто стоит вот это вот level db,
2880880	2884820	или rocks db, как раз вот за счет вот этих вот ее фишек.
2885700	2891140	Очень жестко структурированные транзакции, прибитые прям гвоздями, там, по размеру,
2891220	2895400	по времени исполнения, предсказуемая вот эта компактификация, как бы,
2895620	2901440	и отсутствие таких производительности просадок таких жестких, вот.
2901520	2903660	Потому что для блокчейна это смерти подобно.
2904280	2910360	Если вы можете какой-то транзакции вызвать, не знаю, залипание блокчейн ноды
2910880	2914140	в очень серьезное время, как бы, вы, по сути, атаковали блокчейн.
2914340	2919920	Вот, если найдете такую штуку, вот, можете приватно отрепортить, как бы, разработчикам,
2920020	2920780	получите баунти.
2922660	2929740	Теперь, опять же, с этой точки зрения, тоже, как бы, у кого не было, у кого не было баз данных,
2930280	2932020	объясню, что такое хранимая процедура.
2932280	2938480	Хранимая процедура – это как раз вот эта вот пачка вставок, делитов, еще какая-то логика,
2938480	2940780	там, типа, если, как бы, там, не знаю, там, денег.
2940880	2945820	Больше нуля, то еще сделать вставку в такую-то таблицу, и так далее, и так далее.
2946320	2947440	Там, проапдейтить.
2947880	2953420	И вся вот эта вот штука, она, по сути, лежит в базе данных, прям код, как бы, вот этой вот процедуры,
2953540	2958640	он прям лежит прямо в SQL-базе данных, и вы вызываете его названием функции.
2958700	2964860	Ну, например, в Тинькофф, как бы, приносите деньги, там, не знаю, там, оплата, как бы, за кредит.
2965280	2970380	У него в базе вызывается вот эта вот хранимая процедура, что же это про сейджи,
2970880	2978540	как бы, увеличит вам баланс, потом, там, типа, удалит, там, типа, задолженность за текущий месяц,
2978800	2981780	за current month, там, не знаю, платеж, например, если за кредит.
2982460	2987300	Типа, если, как бы, там, остались еще деньги, как бы, на кредите,
2987420	2992380	то он вам еще добавит, короче говоря, еще план платежей на следующий месяц,
2992900	2995260	проапдейтит ваш кредитный рейтинг.
2995860	2999600	И исполняться вот эта функция, она будет тоже, как бы, атомарной.
3000400	3000840	Да.
3000880	3004680	То есть либо выполнится, либо целиком не выполнится, как бы,
3004740	3009260	либо целиком выполнится, то есть для того, чтобы целостность в базе данных обеспечена.
3009400	3011600	Такие штуки называются хранимые процедуры.
3012980	3016100	Вот, там, по-разному, там, вот, там, вызывают в разных базах,
3016180	3020980	там, где функции, где хранимые процедуры, вот, в общем, там, терминологии, как бы, очень много.
3021660	3025260	Но, по сути, это, как бы, пачка атомарных действий с...
3025900	3028400	Атомарная пачка действий из базы данных.
3028860	3030640	И смарт-контракты очень похожи на вот эти...
3030880	3032640	хранимые процедуры. То есть если просто
3032640	3034540	рассматривать эфир как базу данных, то как бы
3034540	3036420	смарт-контракт это, можно сказать, как бы в нем
3036420	3038560	хранимые процедуры. Транзакции,
3038640	3040120	это понятно, как бы пишущие,
3040480	3042800	это транзакции, которые пишут
3042800	3044720	в базу, то есть такая же
3044720	3046700	аналогия. Консенсус
3046700	3049140	алгоритма это репликация мастер-мастер,
3050260	3050660	то есть точно
3050660	3052700	так же как бы то, что здесь
3052700	3054760	у нас ноды для того, чтобы
3054760	3056820	договориться о том, как бы
3056820	3058740	принять блок или не
3058740	3060540	принять блок, использовать для этого как бы
3060540	3062540	деньги какие-то там, я не знаю,
3062660	3064460	там Proof of Work или там Kilowatt,
3064560	3066600	или там в Proof of Stake договариваться
3066600	3068820	как бы входишь ли ты в список валидаторов,
3068880	3070480	за которые деньгами проголосовали.
3070880	3072340	Это на самом деле второй вопрос.
3073580	3074940	Здесь просто получается
3074940	3076180	решать вот эту проблему
3076180	3078720	распределенного консенсуса этой репликации
3078720	3080780	при помощи экономических механизмов.
3080780	3082780	Потому что многие действия как бы просто
3082780	3084680	невыгодны большинству участников.
3086020	3086840	Вот. А
3086840	3088680	по сути это как бы и есть та самая
3088680	3090080	репликация мастер-мастер,
3090080	3092200	причем это на
3092200	3094520	низком уровне это репликация
3094520	3096040	LevelDB, ну там или
3096040	3098360	ROXDB, там неважно, какие вы или базы данных
3098360	3100360	как бы получаются, на самом деле как бы по сути
3100360	3102580	это механизм репликации
3102580	3104260	для вот этих вот баз данных, так если
3104260	3105900	прям совсем как бы на пальцы.
3107440	3107860	Вот.
3108120	3110300	Тогда в этом случае наш write a headlock
3110300	3112180	вот этот, в который мы как бы складируем
3112180	3114000	транзакции одни за другой, потом их
3114000	3116500	оформляем как бы в пачки и накатываем
3116500	3117920	их, то есть на там
3117920	3118520	чекпоинт,
3120080	3122080	то как бы вот это вот наш пул транзакций
3122080	3124140	в P2P, который висит
3124140	3125940	полностью такой публичный,
3126620	3127800	а чекпоинты
3127800	3128980	и коммиты в этом
3128980	3132440	в этом write a headlock
3132440	3134080	это по сути как бы новые блоки.
3134920	3135920	То есть произвели блок,
3136040	3138140	взяли вот такое вот количество транзакций,
3138740	3139840	а тамарных накатили
3139840	3142080	как бы на state database, если потом блок
3142080	3143780	нам не понравился, мы его откатили
3143780	3144960	так же как бы а тамарных.
3145700	3148000	Там вернулись вот сюда как бы к предыдущему
3148000	3148920	как бы чекпоинту.
3150080	3153100	Это к тому, что
3153100	3154980	как бы блокчейн не какие-то там
3154980	3157020	космолеты, а на самом деле в общем по сути
3157020	3158740	используют штуки, которые
3158740	3161020	большие, там крупные
3161020	3162880	как бы сайты, высоконагруженные
3162880	3164900	приложения, как бы используют уже годами.
3165080	3166320	То есть там уже очень много
3166320	3169120	всего сделано. Там под капотом на самом
3169120	3170700	деле все те же самые механизмы
3170700	3172020	находятся.
3173200	3174500	Вот это про как бы
3174500	3176640	аналогии с базой данных.
3178320	3179240	Теперь про
3179240	3180060	сам шаг.
3180080	3182120	Смарт-контракт. Так, давайте по прошлому.
3182280	3183860	Материалы есть? Какие-то вопросы?
3189960	3190520	Тишина.
3191240	3191720	Все понятно.
3192160	3194380	Да, вопросов нет. Отлично.
3195420	3196560	Так, я еще хотел узнать
3196560	3200360	как идет ли у нас
3200360	3202000	запись. Да, идет. Отлично.
3202480	3203700	Так, поехали.
3203980	3204860	Вращаю обратно.
3208180	3209960	Теперь что же
3210080	3212120	с собой представляется собственно сам
3212120	3214400	смарт-контракт? Что на них можно
3214400	3216080	делать? Тоже немножко сегодня
3216080	3216840	поговорим.
3218600	3220120	Вернемся обратно как бы
3220120	3222180	к той нашей как бы прошлой табличке.
3222560	3224100	Что значит у нас там был Вася,
3224580	3226520	у него соответственно
3226520	3227900	был баланс эфира,
3228840	3230320	у него был анонс
3230320	3232040	счетчик его транзакций,
3232680	3234320	у него не было никакого кода,
3235400	3236480	вот, у него не было
3236480	3237960	никакого там сториджа.
3240080	3242440	Вот. И потом он задеплоил
3242440	3243740	смарт-контракт в сеть.
3244200	3246060	У этого смарт-контракта появился
3246060	3248620	адрес, что очень важно. То есть у смарт-контрактов
3248620	3249300	есть адрес.
3250020	3252260	У него есть баланс эфира. Когда он создал
3252260	3253940	он, например, был ноль, как бы, но
3253940	3256220	в принципе, если контракт позволяет
3256220	3258060	его код принять себе
3258060	3259760	как бы эфир, то он может как бы быть
3259760	3262040	и не нулевым. У него тоже
3262040	3263720	есть нонс у этого контракта.
3264160	3266040	Он меняется, если контракт
3266040	3267960	создает другие контракты, то есть
3267960	3270040	деплоит как бы там следующие,
3270080	3271840	как бы там контракты, то у него
3271840	3272720	нонс меняется.
3274040	3274480	Вот.
3275860	3277320	У него есть байт-код.
3278980	3279940	То есть прям вот
3279940	3281500	как, не знаю, как содержимое
3281500	3283120	экзешника, грубо говоря, по сути.
3284340	3285940	Машинные инструкции, как бы, которые
3285940	3286920	исполняются EOM.
3287800	3289860	А, и этот код, как бы, может обращаться
3289860	3291620	к своему собственному сториджу,
3291780	3293760	который представляет собой k-value.
3293960	3294780	Я вообще решил, наверное,
3295340	3298120	ну, я раньше всегда рисовал вот так вот,
3298120	3300060	типа кусочки в этом k-value, там, типа,
3300080	3302020	что у адреса один, там, такие-то данные,
3302080	3304340	у адреса два, как бы, вторые, другие данные.
3304840	3306100	Но это вообще не очень правильно,
3306440	3308020	когда я вам рисую, как бы,
3308080	3310020	ну, я очень люблю вот эту картинку,
3311040	3312040	когда здесь, типа, код,
3312300	3314080	а здесь у нас записано, типа, что там
3314080	3316040	у Васи, как бы, 100 токенов, значит,
3316140	3318440	а у Пети 200 токенов.
3318500	3320020	Вот просто может, как бы, показаться,
3320140	3322120	что они один за другим идут,
3322220	3324180	как бы, вот эти вот адреса, там, как-то в памяти
3324180	3325840	они, там, располагаются рядом.
3326120	3328040	На самом деле, ну, не так.
3328040	3330020	То есть вся адресация, она именно k-value,
3330080	3332240	то есть у этого есть ключ, как бы,
3332400	3333500	у этого есть ключ,
3334240	3336240	а value является,
3336320	3337280	как бы, вот этой вот штукой.
3337680	3340000	Вот, может, какой-то другой способ изобретать, рисовать
3340000	3341640	эту вещь. Вот.
3343500	3343980	Значит,
3344280	3348000	очень важная, как бы, история о том,
3348160	3349400	как устроен
3349400	3351920	storage-контракт. Это штука
3351920	3353820	такая, как бы, тоже
3353820	3355160	относится к тому, что я сейчас
3355160	3356340	рисовал.
3358120	3358600	Смотрите,
3359280	3359900	у меня,
3360080	3362680	один и тот же код, у меня есть какая-нибудь переменная,
3362680	3364680	variable a,
3364680	3368280	значит, она где-то, как бы, в storage-е находится.
3368280	3370280	Вот, вот здесь, вот у меня, вот здесь,
3370280	3372280	ссылается, как бы, на переменную a.
3372280	3374280	У меня там записано 100.
3374280	3376280	Как бы, потом я говорю a равно 200,
3376280	3378280	как бы, здесь становится 200.
3378280	3380280	И
3380280	3382280	вот этот вот код, представьте,
3382280	3384280	что он...
3384280	3386280	Ой, простите.
3386280	3388280	Тихо, ну.
3388280	3389280	Что этот код, он, как бы, не имеет никакого значения.
3389280	3391280	Что этот код, он, на самом деле, находится
3391280	3393280	на большом количестве разных компьютеров
3393280	3395280	с разной архитектурой.
3395280	3397280	Если бы мы этот код
3397280	3399280	запускали, как бы, в разных, там,
3399280	3401280	ну, не знаю, там, на JS
3401280	3403280	и в разных браузерах, на
3403280	3405280	C++, короче говоря, на разных
3405280	3407280	машинах, то у нас у этой
3407280	3409280	переменной каждый раз бы выделялся
3409280	3411280	определенный адрес памяти, какой-нибудь, там,
3411280	3413280	0x, там, не знаю, там,
3413280	3415280	fa0000001,
3415280	3417280	кто там на C, там, прогал.
3417280	3419280	Вот.
3419280	3421280	И эти адреса
3421280	3423280	этой переменной, они, на самом деле,
3423280	3425280	были бы разные. То есть в другом контракте,
3425280	3427280	как бы, по D2A было бы
3427280	3429280	выделено, было бы выделено другое
3429280	3431280	место в памяти с другим
3431280	3433280	адресом, там, и так далее, и так далее.
3433280	3435280	Значит, для того, чтобы
3435280	3437280	даже storage,
3437280	3439280	как бы, имел полностью детерминированный
3439280	3441280	вид на всех, как бы, компьютерах,
3441280	3443280	переменные в смарт-контрактах,
3443280	3445280	все внутренние, как бы, они адресуются
3445280	3447280	исключительно по ключу. Вот.
3447280	3449280	Причем довольно просто.
3449280	3451280	Смотрите, у меня есть смарт-контракт,
3451280	3453280	я объявил в нем первую переменную
3453280	3455280	размером,
3455280	3457280	ну, здесь у нас
3457280	3459280	все будет размером 256 бит,
3459280	3461280	практически все по дефолту, то есть любые
3461280	3463280	данные размером 256 бит, любые
3463280	3465280	ключи размером 256 бит.
3465280	3467280	Сейчас объясню, почему.
3467280	3469280	Я создал первую
3469280	3471280	переменную, и
3471280	3473280	грубо говоря, так называемый
3473280	3475280	слот, есть такое, как бы,
3475280	3477280	понятие в смарт-контрактах, вот этот вот слот,
3477280	3479280	как бы, его адрес
3479280	3481280	будет равен хэшу,
3481280	3483280	вот тот самый, как бы, там,
3483280	3485280	алгоритм хэширования, от
3485280	3487280	адреса контракта и
