start	end	text
5015280	5017280	что мы там такого сделали, как бы,
5017280	5019280	и так далее. То есть, вот это вот
5019280	5021280	эффективная утилизация, как бы, железа
5021280	5023280	штука важная. И если вы собираетесь
5023280	5025280	в крупную компанию, как бы, идти,
5025280	5027280	то там, возможно, как бы,
5027280	5029280	оптимизация пары строчек
5029280	5031280	кода может спасти компании, там, не знаю,
5031280	5033280	миллион долларов в месяц, спокойно,
5033280	5035280	на серверах, просто потому что они перестанут,
5035280	5037280	их не нужно будет такого количества.
5037280	5039280	Так что это важно.
5039280	5041280	Вот. Значит,
5041280	5043280	итак, EVM у нас представляет
5043280	5045280	собой такой, как бы, процессор,
5045280	5047280	мы бежим, как бы, по инструкциям,
5047280	5049280	у него есть
5049280	5051280	instruction pointer,
5051280	5053280	который говорит, на какой я сейчас
5053280	5055280	инструкции нахожусь,
5055280	5057280	у него есть, соответственно, память,
5057280	5059280	если эта инструкция делает какой-нибудь
5059280	5061280	M-load, там, не знаю, там,
5061280	5063280	загружать какие-то данные с памяти,
5063280	5065280	то процессор, как бы, сходит по вот этому адресу
5065280	5067280	в оперативную память, возьмет данные,
5067280	5069280	загрузит их куда-то там
5069280	5071280	в регистр, у него есть
5071280	5073280	stack,
5073280	5075280	ну, вот это, соответственно, memory называется,
5075280	5077280	у него есть обязательно stack,
5077280	5079280	значит,
5079280	5081280	как stack работает, тоже, как бы, надо знать,
5081280	5083280	да, всякие, надеюсь, как бы, все знают,
5083280	5085280	это push-pop,
5085280	5087280	да, то есть положили на stack что-то,
5087280	5089280	оно, как бы, попало вот сюда,
5089280	5091280	мы сделали push,
5091280	5093280	и stack pointer,
5093280	5095280	то есть указательно переместился
5095280	5097280	вверх, как бы, еще сделали
5097280	5099280	push, как бы, он еще вверх поместился,
5099280	5101280	сделали pop, как бы, мы
5101280	5103280	вернулись вниз, как бы, про вот эти вот забыли
5103280	5105280	данные.
5105280	5107280	Чем stack, как бы, удобен, да, тем, что
5107280	5109280	для того, чтобы, как бы, следить за stack-ом, нам
5109280	5111280	достаточно хранить одно число, вот это вот,
5111280	5113280	stack pointer, и все, как бы,
5113280	5115280	то есть и тогда у нас вот эти все push и pop
5115280	5117280	как бы прекрасно работают.
5117280	5119280	Соответственно, она
5119280	5121280	бежит по инструкциям последовательно,
5121280	5123280	исполняет, как бы, каждую инструкцию,
5123280	5125280	вот, и, как бы,
5125280	5127280	до тех пор, пока, как бы, не наткнется,
5127280	5129280	типа, на все там, типа, окей, я
5129280	5131280	закончила.
5131280	5133280	При этом, как мы с вами в тот раз, как бы,
5133280	5135280	выяснили, она каждый раз добавляет
5135280	5137280	сколько было
5137280	5139280	потрачено на данную инструкцию
5139280	5141280	газа, то есть у нас
5141280	5143280	есть специальные, как бы, цены, как бы,
5143280	5145280	на вот этот вот газ,
5145280	5147280	вот, и если
5147280	5149280	этот газ, газ,
5149280	5151280	газ,
5151280	5153280	становится больше определенного лимита,
5153280	5155280	какого-то там серьезного, не знаю, там,
5155280	5157280	10 миллионов газа, например, там,
5157280	5159280	то делается реверт,
5161280	5163280	то есть все откатывается,
5163280	5165280	и, как бы,
5165280	5167280	транзакция падает с
5167280	5169280	сообщением out of gas, но при этом
5169280	5171280	включается в блок, как бы, и вам придется,
5171280	5173280	как бы, заплатить за это. Лимит
5173280	5175280	этот указывает пользователь, то есть вы
5175280	5177280	в своей транзакции говорите, я готов
5177280	5179280	потратить не больше, чем там
5179280	5181280	100, чем 100 тысяч газа,
5181280	5183280	как бы, то есть это, в принципе, на совести
5183280	5185280	пользователя.
5185280	5187280	Вот. Чисто технически, если я укажу
5187280	5189280	бесконечный лимит, ну, у меня программа, как бы,
5189280	5191280	будет крутиться, пока не доберется
5191280	5193280	до, так называемого, hard, hard
5193280	5195280	лимита. Значит,
5195280	5197280	как это все дело выглядит?
5197280	5199280	Вообще, если мы будем строить
5199280	5201280	блокчейны, да, и нам нужна
5201280	5203280	будет вот именно вот эта вот механика,
5203280	5205280	она во всех блокчейнах на самом деле
5205280	5207280	присутствует, то есть где-то там по-другому
5207280	5209280	чуть-чуть считается, как бы, вот эти вот
5209280	5211280	попугаи, то есть сколько вы потратили
5211280	5213280	вычислительных ресурсов, но там, где они считаются,
5213280	5215280	как бы, это не блокчейны.
5215280	5217280	Вот. Блокчейны, как раз, только там,
5217280	5219280	где это считается, как бы,
5219280	5221280	и смарт-контракты.
5221280	5223280	Мы бежим. В принципе, можно построить
5223280	5225280	несколькими способами. Значит,
5225280	5227280	первое — это написать свою собственную
5227280	5229280	виртуальную машину, что и сделал Эфир.
5229280	5231280	Они написали, как бы, EVM, вот здесь
5231280	5233280	всякие, можно даже посмотреть примеры
5233280	5235280	инструкций,
5235280	5237280	там, не знаю, там, проверка является
5237280	5239280	то, что она лежит на стейке нулем.
5239280	5241280	Затем, если является,
5241280	5243280	то условный переход, там, туда-то,
5243280	5245280	туда-то, вот на вот это вот AE,
5245280	5247280	значит, куда-то.
5247280	5249280	— Какой уровень выполняет стэк?
5249280	5251280	Это стэковые машины?
5251280	5253280	— Да.
5253280	5255280	Вот. Я
5255280	5257280	прям про стэк сейчас,
5257280	5259280	ну, я сейчас прям подробно расскажу.
5259280	5261280	Потому что здесь есть
5261280	5263280	серьезные отличия.
5263280	5265280	Это значит написать свою
5265280	5267280	виртуальную машину. Второй
5267280	5269280	подход, как бы, который, на самом деле,
5269280	5271280	к которому идет прям очень широкая работа,
5271280	5273280	как бы, — это использовать WebAssembly.
5273280	5275280	WebAssembly — это
5275280	5277280	наш новый с вами, короче,
5277280	5279280	JavaScript,
5279280	5281280	такой, когда у вас есть браузер,
5281280	5283280	и вам здесь надо, там, 3D-модель нарисовать,
5283280	5285280	как бы, и крутить ее, и сделать это на
5285280	5287280	JS, как бы. Вы когда попробуете
5287280	5289280	сделать на JS, как бы, вы офигеете,
5289280	5291280	как бы, какая у вас будет производительность,
5291280	5293280	вряд ли у вас это получится.
5293280	5295280	И для этого появился стандарт
5295280	5297280	WebAssembly, который позволяет вам
5297280	5299280	написать программу, как бы, на
5299280	5301280	таком ассемблере. Вот он
5301280	5303280	вот так вот приблизительно выглядит.
5303280	5305280	И просто
5305280	5307280	прямо на JS-кой странице, типа,
5307280	5309280	сказать, там, JS, там, не знаю, там,
5309280	5311280	compile, там, что-нибудь там,
5311280	5313280	JS, там, .exec, вот этот вот
5313280	5315280	ассемблерный код. И в браузер
5315280	5317280	встроена виртуальная машина,
5317280	5319280	которая исполняет вот этот WASM,
5319280	5321280	и она делает это, там, в тысячу раз быстрее,
5321280	5323280	чем это делать на QNAME или каким-нибудь
5323280	5325280	при помощи JS-а.
5325280	5327280	Пробрасывает прямо в процессор инструкции,
5327280	5329280	там, и так далее. То есть
5329280	5331280	эта штука в тысячу раз быстрее, чем
5331280	5333280	такой, как бы,
5333280	5335280	JavaScript на стероидах, как бы,
5335280	5337280	ассемблерный. Тоже очень
5337280	5339280	популярная, как бы, штука.
5339280	5341280	И, конечно, хотелось бы, да,
5341280	5343280	писать смарт-контракты именно
5343280	5345280	на WebAssembly. Тем более, как бы,
5345280	5347280	WebAssembly
5347280	5349280	у него есть компиляторы,
5349280	5351280	компиляторы, которые
5351280	5353280	компилируют вот этот вот WASM
5353280	5355280	в WebAssembly
5355280	5357280	прямо там, ну, что хотите, хотите, там,
5357280	5359280	Python, JS, короче говоря,
5359280	5361280	там, Rust,
5361280	5363280	и так далее, там, не знаю, там, C,
5363280	5365280	C++. Все это, как бы, можно просто
5365280	5367280	компилировать именно как раз
5367280	5369280	в WebAssembly, и он будет исполняться в браузере
5369280	5371280	со всеми
5371280	5373280	штуками. Но у нас, конечно,
5373280	5375280	на WebAssembly в блокчейнах,
5377280	5379280	как я говорил, как бы, накладываются
5379280	5381280	требования по детерминизму,
5381280	5383280	поэтому у вас вот этот WebAssembly
5383280	5385280	в чистом виде, вот как в WebStore
5385280	5387280	стандарт, как бы, он не используется
5387280	5389280	в блокчейнах, потому что у него внутри
5389280	5391280	здесь может быть, как бы, какой-то рандом,
5391280	5393280	у него там есть
5393280	5395280	получение текущего времени
5395280	5397280	внутри этого WebAssembly, там, у него есть,
5397280	5399280	короче говоря, FPU
5399280	5401280	инструкции, и они все, как бы, ломают
5401280	5403280	детерминизм, вот. Поэтому
5403280	5405280	там, где WebAssembly используется,
5405280	5407280	в частности, там, в Polkadot
5407280	5409280	используются вот эти
5409280	5411280	смарт-контракты на WebAssembly в EOS,
5411280	5413280	еще там, на самом деле,
5413280	5415280	в кучу языков, да и эфир, в общем-то,
5415280	5417280	тоже, как бы, у него есть там
5417280	5419280	EIP и там стандарты
5419280	5421280	и подход к снаряду, они тоже,
5421280	5423280	как бы, хотели переезжать на WebAssembly,
5423280	5425280	вот, пока, как бы,
5425280	5427280	не переехали там, просто WebAssembly
5427280	5429280	в этой виртуальной машине, вот это
5429280	5431280	выпиливается и остается,
5431280	5433280	как бы, голый WebAssembly,
5433280	5435280	ну, такой, как бы,
5435280	5437280	детерминированный, вот. С ним
5437280	5439280	уже, там, соответственно, можно работать.
5439280	5441280	Ну, еще, в принципе,
5441280	5443280	один из кандидатов, как бы, это
5443280	5445280	и Яловский, и, там,
5445280	5447280	C-Sharp, короче, Bytecode,
5447280	5449280	вот такой, ну, как бы, чем не виртуальная машина
5449280	5451280	софтовая, как бы, в теории, как бы, тоже
5451280	5453280	можно использовать, но
5453280	5455280	тоже придется, как бы, поколдовать детерминизм,
5455280	5457280	чтобы ничего вот этого, как бы, не было.
5457280	5459280	Вот.
5459280	5461280	Ну, вот, часто бывает, что, как бы,
5461280	5463280	пишут блокчейны,
5463280	5465280	типа, у нас есть смарт-контракты, но они заботятся
5465280	5467280	о вот этом детерминизме, поэтому,
5467280	5469280	как бы, да, имейте в виду, в эту ловушку
5469280	5471280	не попадаете, там, просто не понимают,
5471280	5473280	как бы, люди.
5473280	5475280	Вот. Значит,
5475280	5477280	по поводу stack-based
5477280	5479280	машины. Значит, что, значит, вообще
5479280	5481280	stack-based,
5481280	5483280	stack-based
5483280	5485280	и register-based?
5485280	5487280	Мне кажется,
5487280	5489280	все знают, что это такая машина.
5489280	5491280	Ну,
5491280	5493280	не знаю, вот, не уверен,
5493280	5495280	если кто-то, как бы, на ASME, как бы, не писал.
5495280	5497280	Посмотрите, у меня есть какая-то
5497280	5499280	функция, которая принимает, как бы, два
5499280	5501280	аргумента, значит, она что-нибудь, там, делает
5501280	5503280	A плюс B, короче, возвращает,
5503280	5505280	там, типа, делает return,
5505280	5507280	return
5507280	5509280	A плюс B.
5509280	5511280	Вот. Такая. Я ее,
5511280	5513280	соответственно, в ASME пишу.
5513280	5515280	Вот.
5515280	5517280	И, значит, как
5517280	5519280	выглядит стековая машина? У меня есть
5519280	5521280	stack.
5521280	5523280	И,
5523280	5525280	как бы, вот эти слова stack и register,
5525280	5527280	на самом деле, ну, прям можно
5527280	5529280	воспринимать, как парадигма
5529280	5531280	передачи параметров функций. То есть,
5531280	5533280	каким образом функция получает свои
5533280	5535280	параметры. В стековой машине,
5535280	5537280	как бы, вот этот код вызову этой функции,
5537280	5539280	когда я сделаю, там,
5539280	5541280	F от 3 и 5,
5541280	5543280	вызову, как бы, ее,
5543280	5545280	то мне
5545280	5547280	компилятор создал следующий
5547280	5549280	код. Он сделает push
5549280	5551280	5, там, push
5551280	5553280	3 или push 3
5553280	5555280	push 5, как бы, там, по-разному.
5555280	5557280	Затем вызывает функцию
5557280	5559280	сложить
5559280	5561280	and,
5561280	5563280	ну, и потом, соответственно,
5563280	5565280	ну, не знаю, там, это
5565280	5567280	return, короче говоря, или, там,
5567280	5569280	не знаю, там, загрузить
5569280	5571280	со стека, как бы, результат,
5571280	5573280	там, не знаю, там, load, короче говоря,
5573280	5575280	там, в какой-нибудь, там,
5575280	5577280	память. Значит,
5577280	5579280	как это будет выглядеть? Сначала я положу
5579280	5581280	на stack 5, потом
5581280	5583280	я положу на stack 3, потом
5583280	5585280	я вызываю функцию add, которая, что делает?
5585280	5587280	Она делает pop
5587280	5589280	3, то есть она снимает, как бы, 3
5589280	5591280	со стека сначала, потом снимает
5591280	5593280	5 со стека, а потом кладет на stack
5593280	5595280	8. То есть делает push, как бы, вот,
5595280	5597280	8.
5597280	5599280	Ну, и, соответственно, я знаю,
5599280	5601280	что после выполнения этой инструкции, как бы,
5601280	5603280	на стеке будет результат вот этих вот
5603280	5605280	вот этих вот операций.
5605280	5607280	То есть это, как бы, простой достаточно способ.
5607280	5609280	А
5609280	5611280	register-based
5611280	5613280	виртуальные машины, они, как бы,
5613280	5615280	работают как? Они, на самом деле,
5615280	5617280	делают не push, а они делают
5617280	5619280	давайте в
5619280	5621280	первый регистр запишем 5,
5621280	5623280	затем, там, в EBX
5623280	5625280	запишем 3,
5625280	5627280	а потом, как бы, вызовем add,
5627280	5629280	там, там, EACS, там, EBX,
5629280	5631280	там, и так далее. То есть они, как бы, будут
5631280	5633280	использовать регистры,
5633280	5635280	как, собственно, используют наши,
5635280	5637280	как используют наши процессоры, там,
5637280	5639280	всякие intelовые, там, рисковые, и так далее.
5639280	5641280	Вот. И тогда в регистре
5641280	5643280	EACS, как бы, уже появятся, там,
5643280	5645280	результаты от 8, и мы его запишем
5645280	5647280	в память. То есть в теории
5647280	5649280	можно было бы сделать EVM, как бы,
5649280	5651280	и регистровать, то есть сделать, там,
5651280	5653280	нам пачку регистров договориться
5653280	5655280	о том, как между ними продают
5655280	5657280	передаются параметры и делать
5657280	5659280	вот эту вот стековую машину.
5659280	5661280	Значит,
5661280	5663280	у регистровой машины,
5663280	5665280	которая, там, напрямую работает
5665280	5667280	с процессором, у нее, наверное,
5667280	5669280	у нее, в общем-то, есть, как бы, преимущество,
5669280	5671280	потому что операции с регистрами, они быстрее, чем
5671280	5673280	операции со стеком. То есть
5673280	5675280	процессор гораздо быстрее, как бы, работает,
5675280	5677280	там, все перекидывает, как бы, в
5677280	5679280	регистрах. Если, там, дальше вот это
5679280	5681280	используется для дальнейших вычислений, все будет
5681280	5683280	прям сильно-сильно быстрее, не надо
5683280	5685280	в память ходить, там, и так далее.
5685280	5687280	То есть, это преимущество у регистровых
5687280	5689280	машин есть. Ну, еще можно, там, разные
5689280	5691280	окна регистров использовать, если вот
5691280	5693280	эти заняты, можно потом пойти, там,
5693280	5695280	ЕЦХ, ЕДХ, как бы, их, там,
5695280	5697280	современных процессоров, этих процессоров,
5697280	5699280	этих регистров немерено.
5699280	5701280	Вот, можно кучу всяких разных, там,
5701280	5703280	оптимизаций делать, но
5703280	5705280	это бьет, правда, по детерминизму
5705280	5707280	исполнения. То есть,
5707280	5709280	потому что здесь
5709280	5711280	внутри есть всякие предсказания, там,
5711280	5713280	переходов, и вот эти вот окна
5713280	5715280	регистров в процессоре, то есть, когда
5715280	5717280	у процессора, как бы, один и тот же набор
5717280	5719280	регистров, он мгновенно переключается
5719280	5721280	между, там, десятками, сотнями,
5721280	5723280	как бы, версий. Наш
5723280	5725280	процессор, когда мы в операционной системе
5725280	5727280	работаем, он постоянно между процессорами
5727280	5729280	переключается, и он, по сути, сейчас
5729280	5731280	он выполнял, там, Notepad,
5731280	5733280	а сейчас ему надо, как бы, в часы
5733280	5735280	как-то переключиться, Clock. Он раз, короче,
5735280	5737280	перескочил, сразу следующий контекст,
5737280	5739280	там уже другой набор регистров.
5739280	5741280	Потом, там, еще какой-нибудь, там, Scheduler,
5741280	5743280	как бы, там другой набор регистров, он, там,
5743280	5745280	работает постоянно, как бы, с разными
5745280	5747280	контекстами. И
5747280	5749280	поэтому, прям, какого-то такого четкого
5749280	5751280	софтового детерминизма от
5751280	5753280	регистровой машины
5753280	5755280	сложнее его реализовать.
5757280	5759280	Ну, и код сильно сложнее, как бы,
5759280	5761280	чем у стековой машины. А еще,
5761280	5763280	что важно, если у вас
5763280	5765280	вместо стековой машины находится такой
5765280	5767280	софтовый процессор, как бы, с регистрами,
5767280	5769280	то вам, чтобы сохранить его состояние,
5769280	5771280	если вам нужно
5771280	5773280	save сделать,
5773280	5775280	то вам нужно сохранить состояние
5775280	5777280	регистров. То есть, вот этот, вот этот,
5777280	5779280	вот этот, вот этот, чему они равны, короче
5779280	5781280	говоря, там, и так далее.
5781280	5783280	А у стековой машины, чтобы сохранить
5783280	5785280	его состояние, надо просто, как бы,
