start	end	text
0	5000	Так, отлично. Значит, сегодня у нас, в общем-то, как раз вторая лекция.
5240	11820	Мы опять, как и в первой лекции, мы попробуем довольно-таки быстро обозреть,
11960	15920	как душами смарт-контракты эфирные, как они работают для того,
16020	19580	чтобы вы дальше могли выбирать себе курсовые проекты,
19680	22560	может быть, там, потыкать где-то в код, как бы посмотреть.
23880	27400	Первая домашка, соответственно, тоже к курсу, как бы это, по сути,
27400	31540	внести дифы в Solidity код, вот, особо не пугайтесь,
31640	35260	он достаточно легко, как бы, читается, и модифицировать его тоже, как бы, несложно.
36520	39460	Вот, сложности, как бы, смарт-контрактов, они, на самом деле, в понимании
39460	43360	таких низкоуровневых механизмов, вот, как бы, в самом, там, грубо говоря,
43440	48240	написании кода, там, большого количества каких-то таких страшных тонкостей нет.
49500	50640	Вот, значит, поехали.
52280	57240	Возвращаясь к процессингу транзакций, то есть на этот раз мы уже их посмотрели,
57400	61840	затем со стороны клиента, то есть как это выглядит вообще общение со смарт-контрактами
61840	64940	для клиентов, то есть для ваших, там, пользователей, вот.
65880	72440	Ну, например, предположим, я зашел на какой-то сайт, который посвящен финансам,
72740	77600	я сейчас нахожусь в тестовой сети, сейчас уже не помню в какой, в Герле.
78460	81080	Вы ее, кстати говоря, будете довольно часто использовать, возможно,
81080	87080	имеет смысл, как бы, туда, как бы, деплоить свои, не знаю, там, проекты,
87400	91280	то есть вы можете там разворачивать свои контракты, пользоваться этой сетью спокойно.
92100	96740	В Герле сейчас наиболее из всех вот этих вот тестовых сетей, как видите, там много.
97840	101020	Ринки бай уже, как бы, скоро будет деприкейтед.
102540	106640	Герле сейчас наиболее такая свежая, как бы, которая поддерживает последнюю версию эфира,
106640	112020	как бы, так что, значит, в ней, собственно, и, скорее всего, придется работать.
112820	113500	Очень удобно.
113900	116640	А там есть копия сайта, ну, кстати, да, в отличие, как бы, от источника,
117400	123800	остальных от Web2 сервисов, в Web3 можно взять и скопировать свой сервис
123800	126280	и запустить его в тестовые сети с игрушечным эфиром.
126780	131000	Представьте, если бы у вас был там Тинькофф или Сбер, как бы, с игрушечными рублями,
131000	137000	как бы, но стопроцентно повторяющий полностью, абсолютно всю бизнес-логику основного приложения.
138580	138980	Ну, вот.
139940	142900	Там, на самом деле, такие же, такие и есть, как бы, штуки,
143080	146880	и недавно в Сбере была какая-то дичайшая бага как раз с тестовой версией приложения.
147400	150080	Значит, для взаимодействия со смарт-контрактом,
150480	154660	то есть для отправки вот такой же, вот такой вот транзакции,
155300	159420	вот, в которой, как я говорил, находятся вот здесь вот в импуте,
159700	163420	закодировано, какую функцию данного смарт-контракта я хочу вызвать.
163620	166600	То есть я хочу бросить транзакцию вот на этот адрес
166600	170200	и вызвать такую-то функцию с такими-то парами.
170320	172880	Они здесь упакованы, конечно, но, тем не менее,
174000	175160	выглядит это следующим образом.
175160	177260	Ну, там, предположим, я хочу там включить,
177400	181880	не знаю, свой, там, эфир, как калатору.
182780	185180	Я сейчас отправлю, по сути, как бы, функцию, которая говорит,
185320	189440	типа, разреши мне посылать, там, не знаю, эфир в этот смарт-контракт.
189500	191440	То есть у него внутри произойдет запись.
192180	194020	Для клиента это выглядит вот таким вот образом.
194640	197220	То есть у него всплывает вот этот вот метамаск
197220	201600	или какой там у вас есть, там, не знаю, там, кошелек там какой-нибудь
201600	204120	и предлагает эту транзакцию подписать.
204120	206200	Я эту транзакцию подтверждаю.
207400	210220	Я не отправляю никакого эфира, вот.
210240	212720	Но мне, конечно, придется заплатить за эту транзакцию.
212880	213700	Сейчас надо нажать.
214680	215080	Вот.
216020	217640	И все, транзакция, как бы, поехала.
218420	220820	Я жду, пока она, там, что-то там заманится,
220940	223240	пока майнеры ее примут, пока они включат блок,
223360	224300	пока, как бы, но...
224300	229200	Я тоже не особо любитель плюс-сайза, да и таковым не являюсь.
229680	231080	Я думаю, что...
231080	232500	Никита, выключи микрофон.
234020	234420	Да.
234860	237080	И, соответственно, теперь, когда транзакция дошла,
237400	239000	то собновился, вот.
239120	242040	И, соответственно, эфир, как бы, теперь у меня включен.
242100	244780	Я могу теперь его, там, например, не знаю, там,
245120	248440	какое-то количество этого эфира положить, там, не знаю, процент, например.
249200	250720	Будет выглядеть все точно так же.
251620	254540	В чем, как бы, ну, как бы, удобство веб-три приложения,
254600	257820	что я вот ровно таким же образом хожу, там, в сотни проектов
257820	260860	абсолютно разных, как бы, могу делать в них, как бы,
260860	263520	все делать при помощи одного и того же, не знаю,
263620	266800	даже одного и того же адреса, одного и того же, вот, этого расширения.
267840	271680	Нигде, как видите, нет никаких ни логинов, ни регистрации,
271740	273300	вообще ничего, как бы, этого добра нет.
273420	275200	Все свалено на пользователя.
275400	279520	То есть за безопасность своих адресов, своей крипты, я отвечаю сам.
279620	282720	То есть никто мне здесь не поможет никаких, там, восстановить аккаунт,
282820	283860	ничего этого нету.
285160	290360	А так, на секунду, так, вообще, как бы, взломы аккаунтов, угоны,
290360	292600	короче говоря, получение персональных данных,
292720	296200	оно в Web2-сервисах, в разных, там, почтах, как бы, сервисах
296200	297280	очень часто делается.
297400	300560	Как раз через функции восстановления доступа к аккаунту.
301060	304280	Всякие вот эти секретные вопросы, Wi-Fi и так далее.
304400	307140	Вы все это, как бы, в security штуках, как бы, видели.
307820	310200	Ну, вот я положил, там, сколько-то, там, 0.12 эфира,
310280	313240	положил под 11% годовых, все, они там валяются,
313320	314560	потом захочу, как бы, вытащу.
315560	317720	Вот, то есть все, как бы, довольно просто.
318680	320740	И с точки зрения разработки ваших проектов,
320740	323600	это тоже достаточно, как бы, удобно, потому что вы пишете,
324020	326740	ну, если так, в минимальном варианте, то вы пишете смарт-контракт,
327400	331940	деплойте, выкладываете его в сеть, куда-нибудь, там, не знаю, в тест-нет-герле,
332600	336440	и пишете просто на Node.js какой-то, там, простейший, как бы, интерфейс.
337540	341740	Ну, как бы, за этим интерфейсом, там, коду, на самом деле,
341820	344380	там, на три строчки буквально, которые с эфиром общаются,
344520	348340	потому что вся бизнес-логика, по сути, находится там где-то, в тест-нете.
349540	356400	Вот, а бэкэнд вам нужен для того, чтобы на вашем проекте показывать,
356400	357380	ну, всякие, там, цифры.
357400	360800	Цифры, агрегации, там, сколько, там, не знаю, какие там проценты,
361220	364700	total balances, вы можете взять, брать что-то из контрактов,
365380	368580	но что-то вам понадобится, там, агрегировать, собирать статистику,
368680	370460	чтобы пользователю дать больше информации,
370540	372560	и для этого как раз используются бэкэнды, вот,
372640	374400	поэтому с этой точки зрения Web3-разработка,
375620	378400	она включает в себя, в том числе и Web2-разработка,
379100	381340	то есть вам надо, там, курсы какие-то там переводить,
381420	383420	еще что-нибудь, в общем, все это делается на бэке.
384700	387000	Вот, значит, поехали.
387400	389900	Значит, что происходит с транзакцией?
390380	393000	На самом деле, на начальном этапе, когда мы ее только кинули,
393080	396040	когда она попала в ноду, у нее, конечно, нету ни хэша-блоков,
396080	399980	в которые она была включена, ни номера блока, вот,
400140	404580	неизвестно, сколько она потратила газа, эта транзакция,
405000	407080	то есть после того, как она была, как бы, замайнена.
407860	412360	У нее непонятно, на какой позиции в блоке она находится, вот,
412400	415140	но, в принципе, все остальное, как бы, оно, в общем-то, одно и то же,
415140	416240	то есть вот здесь подпись,
416240	421240	сколько эфира она на себе тащит, ее, соответственно, нагрузка,
421840	422980	вот этот hex bytes.
423700	427680	Кстати, что интересно, как бы, хакеры бывают, ну, точнее, не бывают,
427780	430100	когда довольно часто переписываются с проектами
430100	432880	вот посредством вот этих hex bytes,
433080	435540	то есть вы можете отправить там транзакцию кому-нибудь с эфиром
435540	440040	и здесь написать в комментарии, типа, вот, как бы, не знаю, там,
440220	443080	спасибо за хак, короче говоря, вот, заберите часть денег.
444320	445960	То есть бывает такое.
446240	449660	Что и с хакерами переписываются, собственно, через вот эти вот hex bytes тоже бывает.
451120	455640	Значит, что происходило вот здесь, когда я работал с Metamask?
456180	458620	Сделал транзакцию, подписал транзакцию,
459340	461860	затем мой вот этот вот Metamask,
462460	465380	я напоминаю, это не ваше приложение,
465680	468700	то есть не ваш DAP сделал эту транзакцию,
468860	472440	ну, точнее, он ее изготовил, эту транзакцию сформировал,
472440	475520	а подписал и отправил ее именно как раз Metamask,
476240	478480	никакой JS с вашей страницы этого не делает,
478580	482800	это делает расширение в валюту, то есть саму транзакцию отправляет, вот.
483960	486340	Ну, а здесь, как бы, в JS-ке вы можете сделать, там, не знаю,
486440	491100	PubSub, там, подписаться, там, на обновление, там, от Metamask, там, от ноды, как бы,
491160	495460	и в нужный момент, когда пришла информация, что все, транзакция включена,
495560	499380	как бы, галочки переключилась, стейт изменился.
500160	504160	Соответственно, там используется обычный, там, JSON-RPC интерфейс,
504160	509480	обычно у нод есть, как бы, два интерфейса, HTTPS и WebSockets,
509580	513660	WebSockets, которые позволяют, как бы, вам держать все время открытым соединение,
513760	516260	то есть если вам надо, как бы, там, непрерывно получать апдейты,
516360	520160	все время страничку обновлять, как бы, это более удобно, ну, вот.
520260	524460	Здесь, как бы, все стандартно, и поэтому, как бы, ноды, они, по сути,
524560	528960	представляют собой, ну, так, для внешнего наблюдателя, по сути, такой веб-сервер,
529060	533780	который прям JSON-RPC API, то есть открытые порты, как бы, вы можете,
534160	538320	туда кинуть какой-нибудь запрос, и он вам в ответ, как бы, ответит,
538400	543380	как бы, можете кинуть, там, послать транзакцию, и нода, как бы, отправит транзакцию.
544380	548940	Значит, что делает нода? Нода валидирует транзакцию, чтобы ее, там,
548980	553480	мусором не закинули, всякие черновые проверки, кладет, как торрент,
553560	559220	как бы, начинает раздавать, как бы, через торрент и, там, через P2P эту транзакцию, вот.
560120	563220	Причем, там, есть, по сути, как бы, несколько,
564160	569220	несколько протоколов, по которым они работают, там, родной эфирный P2P,
570080	574140	есть стэк, как бы, который использует другие ноды, вот, то есть, несколько вариантов,
574240	577260	как бы, но смысл один и тот же, то есть, нода рассказывает другим, типа,
577360	581520	чуваки, у меня есть, вот, новые хэши транзакций, кому надо, как бы, если хотите,
581620	585440	я вам, типа, перешлю тело этих транзакций, ну, чтобы дважды, как бы, не слать.
586320	591560	Вот, наконец, она добирается, там, до майнера, вот, и, соответственно, майнер,
594160	600500	ее применяет. Значит, затем, ну, и после этого, после того, как, как бы,
600540	605420	нода объявила о транзакции полной ноды, она стоит и ждет, как бы, новых блоков,
605520	609880	подписывается на все, как бы, новые блоки. Когда прилетает новый блок,
610580	614540	она узнает, что, как бы, я жду результатов вот этой транзакции,
614620	617900	то есть, когда она будет включена в блок, она, по сути, как бы, подписана, в общем,
617940	623440	на эти события, вот, она получает новый блок, проверяет его, выбирает,
623440	628120	в соответствии с консенсусом, годится ли этот блок или нет, как бы, попадает ли он
628120	633380	в основную цепочку, в мастер-чейн. Если и надо, как бы, как я там показывал
633380	638300	на схемах, как бы, откатывать, может быть, предыдущие блоки и накатывать вот эти вот
638300	643920	новые, вот, с ревертом, как бы, всех транзакций. Затем накатывает все транзакции
643920	649340	из вот этого нового блока на свою state database. Вот, возможно, среди этих
649340	653420	транзакций есть и наша, вот. И как раз вот в этот момент,
653440	659260	когда она применяет, как бы, этот, ну, применяет, по сути, блок, бежит по
659260	663160	транзакциях и делает вот эту вот apply, вот ровно в этом месте работает код
663160	669360	контракта. Прямо здесь как раз запускается виртуальная машина, вот, и вот здесь, как
669360	674400	бы, она бежит-бежит, как бы, по транзакции, по сути, исполняет, как бы, код контракта.
674400	683060	Вот. Далее она решает, как я говорил, любой smart-контракт, любой вызов к smart-контракту
683060	688160	заканчивается всего двумя исходами, да, типа, все окей, как бы, и реверт, и в случае реверта,
688160	694400	как бы, ну, ничего не происходит. То есть никаких изменений абсолютно, как бы, вот, кроме, как бы,
694400	700040	списания денег с баланса отправителя за потраченный газ. А в самой state database,
700040	704360	как бы, там, во всех, там, данных контракта никаких значений, никаких изменений не происходит.
704360	712340	После чего она обновляет state root, вот это вот в дерево организованное значение, грубо говоря,
713060	719780	state, ну, hash state database, такой общий, который, как бы, зависит от всех значений этой базы
719780	725780	данных, и, соответственно, проставляет транзакции, как бы, сколько было потрачено газа, какой блок
725780	732260	она была включена, там, какой индекс, и так далее, и так далее. В этот момент наш metamask, как бы,
732260	739040	висит на этой ноде, там, по вебсокетам или опрашивает ее по HTTPS, вот, и ждет, когда
739040	743000	появится информация о его транзакции. Значит, приходит новый блок,
743060	749540	он ждет, как бы, будет ли доказательство того, что моя транзакция попала в мой блок. Здесь, как раз,
749540	755960	используются вот эти вот merkle proof, то есть доказательство того, что транзакция, она, как бы,
755960	761060	в блок попала, в то время как в блоке есть буквально одно только число. Ну, про меркл деревья мы с вами
761060	766960	обязательно, там, поговорим подробно, это широко используемый паттерн в блокчейнах. То есть она ждет,
766960	772500	как бы, еще и доказательство того, что транзакция в текущий блок попала, вот.
773060	780060	Затем получает, соответственно, апдейты от ноды, как бы, ну, там, она запрашивает, там, любые, там,
780060	788540	интересные значения, например, там, включен ли флажок он для эфира для вот этого адреса клиента,
788540	796220	который, как бы, запросил. Если да, то он там что-то отрисовывает. Вот, она это все дело опрашивает,
796220	799880	и, как бы, после того, как понятно, что транзакция включена, все изменилось, как бы,
799880	802940	все данные из контрактов получены, она апдейтит мордочку.
803060	807380	Вот, то есть выглядит весь вот этот цикл таким образом.
807380	815020	Кто является клиентами? То есть кто может дергать, как бы, оперировать эфиром? Значит,
815020	820460	самые популярные это браузеры вот с этими расширениями, там, помимо Metamask есть еще много,
820460	827540	там, всего. Есть, там, просто десктопные программы-клиенты, но браузеры, они, почему они,
827540	833060	как бы, наиболее популярны? Ну, потому что, как я сказал, как бы, я своим браузером бегаю, там, я
833060	837860	не знаю, по десяткам, как бы, проектов, что хочу, там, закладываю, перекладываю, как бы, как угодно,
837860	846140	там, не знаю, в финансы регистрируюсь, играю, там, в игры, там, NFT какие-нибудь создаю, и все это
846140	851720	делается при помощи, по сути, одного расширения в этом браузере. Это крайне удобно. Вот, то есть,
